{
  "$schema": "../../chain.schema.json",
  "chainName": "evmostestnet",
  "networkType": "testnet",
  "prettyName": "Evmos Testnet",
  "chainId": "evmos_9000-4",
  "bech32Prefix": "evmos",
  "keyAlgos": [
    "ethsecp256k1"
  ],
  "extraCodecs": [
    "ethermint"
  ],
  "slip44": 60,
  "fees": {
    "feeTokens": [
      {
        "denom": "atevmos",
        "lowGasPrice": 20000000000,
        "averageGasPrice": 25000000000,
        "highGasPrice": 40000000000
      }
    ]
  },
  "staking": {
    "stakingTokens": [
      {
        "denom": "atevmos"
      }
    ]
  },
  "codebase": {
    "cosmosSdkVersion": "0.46",
    "ibcGoVersion": "v6.1.0"
  },
  "apis": {
    "rpc": [
      {
        "address": "https://evmos.test.rpc.coldyvalidator.net"
      },
      {
        "address": "https://evmos-testnet-rpc.polkachu.com"
      },
      {
        "address": "https://evmos-testnet-rpc.publicnode.com:443"
      }
    ],
    "rest": [
      {
        "address": "https://evmos.test.api.coldyvalidator.net"
      },
      {
        "address": "https://evmos-testnet-api.polkachu.com"
      },
      {
        "address": "https://evmos-testnet-rest.publicnode.com"
      }
    ],
    "grpc": [
      {
        "address": "https://evmos.test.grpc.coldyvalidator.net"
      },
      {
        "address": "evmos-testnet-grpc.publicnode.com:443"
      }
    ]
  },
  "explorers": [
    {
      "kind": "Mintscan",
      "url": "https://mintscan.io/evmos-testnet",
      "txPage": "https://mintscan.io/evmos-testnet/txs/${txHash}"
    },
    {
      "kind": "NodesGuru",
      "url": "https://testnet.evmos.explorers.guru/",
      "txPage": "https://testnet.evmos.explorers.guru/transaction/${txHash}"
    }
  ]
}