{
  "$schema": "../../chain.schema.json",
  "chainName": "mantrachaintestnet",
  "status": "live",
  "networkType": "testnet",
  "prettyName": "MANTRA Hongbai Testnet",
  "chainId": "mantra-hongbai-1",
  "bech32Prefix": "uom",
  "daemonName": "mantrachaind",
  "nodeHome": "$HOME/.mantrachain",
  "keyAlgos": [
    "secp256k1"
  ],
  "slip44": 118,
  "fees": {
    "feeTokens": [
      {
        "denom": "uom",
        "fixedMinGasPrice": 0,
        "lowGasPrice": 0.001,
        "averageGasPrice": 0.002,
        "highGasPrice": 0.003
      }
    ]
  },
  "staking": {
    "stakingTokens": [
      {
        "denom": "uom"
      }
    ]
  },
  "codebase": {
    "gitRepo": "https://github.com/MANTRA-Finance",
    "recommendedVersion": "3.0.0",
    "compatibleVersions": [
      "3.0.0"
    ],
    "cosmosSdkVersion": "0.47.3",
    "consensus": {
      "type": "cometbft",
      "version": "0.37"
    },
    "cosmwasmVersion": "0.41",
    "cosmwasmEnabled": true,
    "versions": [
      {
        "name": "1.0.0",
        "recommendedVersion": "1.0.0",
        "compatibleVersions": [
          "1.0.0"
        ],
        "cosmosSdkVersion": "0.47.3",
        "consensus": {
          "type": "cometbft",
          "version": "0.37"
        },
        "cosmwasmVersion": "0.41",
        "cosmwasmEnabled": true
      }
    ]
  },
  "peers": {
    "seeds": [
      {
        "id": "d6016af7cb20cf1905bd61468f6a61decb3fd7c0",
        "address": "seed.hongbai.mantrachain.io:26656",
        "provider": "MANTRACHAIN"
      },
      {
        "id": "8542cd7e6bf9d260fef543bc49e59be5a3fa9074",
        "address": "seed.publicnode.com:26656",
        "provider": "Allnodes ⚡️ Nodes & Staking"
      }
    ],
    "persistentPeers": [
      {
        "id": "da061f404690c5b6b19dd85d40fefde1fecf406c",
        "address": "34.68.19.19:26656",
        "provider": "MANTRACHAIN"
      },
      {
        "id": "20db08acbcac9b7114839e63539da2802b848982",
        "address": "34.72.148.3:26656",
        "provider": "MANTRACHAIN"
      }
    ]
  },
  "apis": {
    "rpc": [
      {
        "address": "https://rpc.hongbai.mantrachain.io",
        "provider": "MANTRACHAIN"
      },
      {
        "address": "https://mantra-testnet-rpc.publicnode.com:443",
        "provider": "Allnodes ⚡️ Nodes & Staking"
      }
    ],
    "rest": [
      {
        "address": "https://api.hongbai.mantrachain.io",
        "provider": "MANTRACHAIN"
      },
      {
        "address": "https://mantra-testnet-rest.publicnode.com",
        "provider": "Allnodes ⚡️ Nodes & Staking"
      }
    ],
    "grpc": [
      {
        "address": "https://grpc.hongbai.mantrachain.io",
        "provider": "MANTRACHAIN"
      },
      {
        "address": "mantra-testnet-grpc.publicnode.com:443",
        "provider": "Allnodes ⚡️ Nodes & Staking"
      }
    ]
  },
  "keywords": [
    "dex",
    "testnet"
  ],
  "images": [
    {
      "imageSync": {
        "chainName": "mantrachain",
        "baseDenom": "uom"
      },
      "png": "https://raw.githubusercontent.com/cosmos/chain-registry/master/mantrachain/images/OM-Prim-Col.png",
      "svg": "https://raw.githubusercontent.com/cosmos/chain-registry/master/mantrachain/images/OM-Prim-Col.svg",
      "layout": "logomark"
    }
  ]
}