{
  "$schema": "../chain.schema.json",
  "chainName": "chain4energy",
  "networkType": "mainnet",
  "website": "https://c4e.io/",
  "prettyName": "C4E",
  "chainId": "perun-1",
  "bech32Prefix": "c4e",
  "keyAlgos": [
    "secp256k1"
  ],
  "slip44": 118,
  "fees": {
    "feeTokens": [
      {
        "denom": "uc4e",
        "fixedMinGasPrice": 0,
        "lowGasPrice": 0.01,
        "averageGasPrice": 0.025,
        "highGasPrice": 0.04
      }
    ]
  },
  "staking": {
    "stakingTokens": [
      {
        "denom": "uc4e"
      }
    ]
  },
  "codebase": {

  },
  "apis": {
    "rpc": [
      {
        "address": "https://rpc.c4e.io/"
      },
      {
        "address": "https://rpc.c4e.nodestake.top"
      },
      {
        "address": "https://c4e.rpc.bccnodes.com"
      },
      {
        "address": "https://chain4energy-mainnet-rpc.autostake.com:443"
      },
      {
        "address": "https://c4e.rpc.m.stavr.tech:443"
      },
      {
        "address": "https://rpc-c4e.takeshi.team"
      },
      {
        "address": "https://rpc-c4e.mzonder.com"
      },
      {
        "address": "https://rpc.cros-nest.com/chain4energy"
      },
      {
        "address": "https://rpc.c4e.indonode.net"
      },
      {
        "address": "https://c4e-rpc.stake-town.com"
      },
      {
        "address": "https://rpc.c4e.silentvalidator.com"
      },
      {
        "address": "http://rpc.c4e.stakeup.tech"
      },
      {
        "address": "https://chain4energy-rpc.stakeangle.com"
      },
      {
        "address": "https://c4e-rpc.genznodes.dev"
      },
      {
        "address": "https://rpc-c4e.theamsolutions.info"
      },
      {
        "address": "https://c4e.rpc.m.anode.team"
      },
      {
        "address": "http://185.245.182.192:46657"
      },
      {
        "address": "http://89.117.58.109:26657"
      },
      {
        "address": "http://c4e.rpc.node75.org:26957"
      },
      {
        "address": "http://164.68.125.243:26657"
      },
      {
        "address": "https://c4e-rpc.antrixy.org/"
      },
      {
        "address": "https://c4e.doubletop.tech/"
      },
      {
        "address": "https://c4e-rpc.kalia.network:443"
      },
      {
        "address": "http://38.242.220.64:16657"
      },
      {
        "address": "http://209.182.239.169:46657"
      },
      {
        "address": "https://rpc.c4e.validatus.com:443"
      },
      {
        "address": "https://rpc-m-c4e.apeironnodes.com:443"
      },
      {
        "address": "http://rpc-c4e.cryptech.com.ua:443"
      }
    ],
    "rest": [
      {
        "address": "https://lcd.c4e.io/"
      },
      {
        "address": "https://api.c4e.nodestake.top"
      },
      {
        "address": "https://c4e.lcd.bccnodes.com"
      },
      {
        "address": "https://chain4energy-mainnet-lcd.autostake.com:443"
      },
      {
        "address": "https://c4e.api.m.stavr.tech"
      },
      {
        "address": "https://api-c4e.takeshi.team"
      },
      {
        "address": "https://api-c4e.mzonder.com"
      },
      {
        "address": "https://rest.cros-nest.com/chain4energy"
      },
      {
        "address": "https://api.c4e.indonode.net"
      },
      {
        "address": "https://c4e-api.stake-town.com"
      },
      {
        "address": "https://api.c4e.silentvalidator.com"
      },
      {
        "address": "http://api.c4e.stakeup.tech"
      },
      {
        "address": "http://chain4energy-rpc.stakeangle.com:1317"
      },
      {
        "address": "https://c4e-api.genznodes.dev"
      },
      {
        "address": "https://api-c4e.theamsolutions.info"
      },
      {
        "address": "https://c4e.api.m.anode.team"
      },
      {
        "address": "http://c4e.api.node75.org:1397"
      },
      {
        "address": "http://164.68.125.243:1319"
      },
      {
        "address": "https://c4e-rest.antrixy.org/"
      },
      {
        "address": "https://c4e-api.kalia.network:443"
      },
      {
        "address": "http://38.242.220.64:11317"
      },
      {
        "address": "http://209.182.239.169:1417"
      },
      {
        "address": "https://api.c4e.validatus.com:443"
      },
      {
        "address": "https://api-c4e.cryptech.com.ua:443"
      },
      {
        "address": "https://lcd-m-c4e.apeironnodes.com"
      }
    ],
    "grpc": [
      {
        "address": "grpc.c4e.nodestake.top:443"
      },
      {
        "address": "c4e.grpc.bccnodes.com:443"
      },
      {
        "address": "chain4energy-mainnet-grpc.autostake.com:443"
      },
      {
        "address": "c4e.grpc.bccnodes.com:443"
      },
      {
        "address": "grpc-c4e.takeshi.team:443"
      },
      {
        "address": "grpc-c4e.mzonder.com:443"
      },
      {
        "address": "http://c4e.grpc.m.stavr.tech:7029"
      },
      {
        "address": "c4e-grpc.stake-town.com:443"
      },
      {
        "address": "grpc.c4e.silentvalidator.com:443"
      },
      {
        "address": "http://chain4energy-rpc.stakeangle.com:1317"
      },
      {
        "address": "c4e-grpc.genznodes.dev:52090"
      },
      {
        "address": "https://grpc-c4e.theamsolutions.info:9391"
      },
      {
        "address": "https://c4e.grpc.m.anode.team"
      },
      {
        "address": "https://c4e-grpc.validatrium.club"
      },
      {
        "address": "http://185.245.182.192:1318"
      },
      {
        "address": "grpc-c4e.stakerun.com:1190"
      },
      {
        "address": "https://c4e-grpc.antrixy.org/"
      },
      {
        "address": "https://c4e.doubletop.tech:443"
      },
      {
        "address": "c4e-grpc.kalia.network:3090"
      },
      {
        "address": "https://c4e.grpc.skynodejs.net"
      },
      {
        "address": "http://38.242.220.64:19090"
      },
      {
        "address": "http://209.182.239.169:9190"
      },
      {
        "address": "https://grpc.c4e.validatus.com:443"
      },
      {
        "address": "https://grpc-c4e.cryptech.com.ua:443"
      }
    ]
  },
  "explorers": [
    {
      "kind": "explorer",
      "url": "https://explorer.apeironnodes.com/chain4energy",
      "txPage": "https://explorer.apeironnodes.com/chain4energy/transactions/${txHash}"
    },
    {
      "kind": "explorer",
      "url": "https://explorer.ppnv.space/c4e",
      "txPage": "https://explorer.ppnv.space/c4e/transactions/${txHash}"
    },
    {
      "kind": "explorer",
      "url": "https://explorer.c4e.io/",
      "txPage": "https://explorer.c4e.io/transactions/${txHash}"
    },
    {
      "kind": "NodeStake Explorer",
      "url": "https://explorer.nodestake.top/chain4energy",
      "txPage": "https://explorer.nodestake.top/chain4energy/transactions/${txHash}"
    },
    {
      "kind": "ùê•ùêûùê¨ùêßùê¢ùê§ | ùêîùêìùêíùêÄ Explorer",
      "url": "https://exp.utsa.tech/c4e",
      "txPage": "https://exp.utsa.tech/c4e/tx/${txHash}"
    },
    {
      "kind": "üî•STAVRüî• Explorer",
      "url": "https://explorer.stavr.tech/c4e",
      "txPage": "https://explorer.stavr.tech/c4e/tx/${txHash}"
    },
    {
      "kind": "BccNodes Explorer",
      "url": "https://explorer.bccnodes.com/chain4energy",
      "txPage": "https://explorer.bccnodes.com/chain4energy/transactions/${txHash}"
    },
    {
      "kind": "NODEXPLORER",
      "url": "https://explorer.nodexcapital.com/c4e",
      "txPage": "https://explorer.nodexcapital.com/c4e/transactions/${txHash}"
    },
    {
      "kind": "atomscan",
      "url": "https://atomscan.com/chain4energy",
      "txPage": "https://atomscan.com/chain4energy/transactions/${txHash}",
      "accountPage": "https://atomscan.com/chain4energy/accounts/${accountAddress}"
    },
    {
      "kind": "AM Solutions Explorer",
      "url": "https://explorer.theamsolutions.info/c4e-main/staking",
      "txPage": "https://explorer.theamsolutions.info/c4e-main/transactions/${txHash}"
    },
    {
      "kind": "AlxVoy ‚ö° ANODE.TEAM Explorer",
      "url": "https://main.anode.team/c4e",
      "txPage": "https://main.anode.team/c4e/tx/${txHash}"
    },
    {
      "kind": "ScanRun",
      "url": "https://scanrun.io/c4e",
      "txPage": "https://scanrun.io/c4e/transactions/${txHash}"
    },
    {
      "kind": "Cryptech",
      "url": "https://explorers.cryptech.com.ua/chain4energy",
      "txPage": "https://explorers.cryptech.com.ua/chain4energy/tx/${txHash}"
    }
  ],
  "images": [
    {
      "png": "https://raw.githubusercontent.com/cosmos/chain-registry/master/chain4energy/images/c4e.png"
    }
  ]
}