{
  "$schema": "../chain.schema.json",
  "chainName": "decentr",
  "networkType": "mainnet",
  "prettyName": "Decentr",
  "chainId": "mainnet-3",
  "bech32Prefix": "decentr",
  "keyAlgos": [
    "secp256k1"
  ],
  "slip44": 118,
  "fees": {
    "feeTokens": [
      {
        "denom": "udec",
        "fixedMinGasPrice": 0.025,
        "lowGasPrice": 0.025,
        "averageGasPrice": 0.025,
        "highGasPrice": 0.025
      }
    ]
  },
  "staking": {
    "stakingTokens": [
      {
        "denom": "udec"
      }
    ]
  },
  "codebase": {

  },
  "apis": {
    "rpc": [
      {
        "address": "https://poseidon.mainnet.decentr.xyz"
      },
      {
        "address": "https://rpc.decentr.chaintools.tech/"
      },
      {
        "address": "https://decentr.rpc.m.stavr.tech:443"
      },
      {
        "address": "https://decentr-rpc.ibs.team/"
      },
      {
        "address": "https://rpc-dcntr.nodine.id/"
      },
      {
        "address": "https://rpc-decentr.mms.team/"
      }
    ],
    "rest": [
      {
        "address": "https://rest.mainnet.decentr.xyz"
      },
      {
        "address": "https://decentr.api.m.stavr.tech"
      },
      {
        "address": "https://api.decentr.chaintools.tech/"
      },
      {
        "address": "https://decentr-api.ibs.team/"
      }
    ],
    "grpc": [
      {
        "address": "https://grpc-decentr.sxlzptprjkt.xyz:443"
      },
      {
        "address": "decentr.grpc.m.stavr.tech:2060"
      },
      {
        "address": "https://grpc.decentr.hexnodes.co"
      },
      {
        "address": "https://grpc.decentr.nodexcapital.com:443"
      },
      {
        "address": "grpc-decentr.mms.team:443"
      }
    ]
  },
  "explorers": [
    {
      "kind": "decentr.net",
      "url": "https://explorer.decentr.net",
      "txPage": "https://explorer.decentr.net/transactions/${txHash}?networkId=mainnet"
    },
    {
      "kind": "ping.pub",
      "url": "https://ping.pub/decentr/",
      "txPage": "https://ping.pub/decentr/tx/${txHash}"
    },
    {
      "kind": "ðŸ”¥STAVRðŸ”¥",
      "url": "https://explorer.stavr.tech/Decentr-Mainnet",
      "txPage": "https://explorer.stavr.tech/Decentr-Mainnet/tx/${txHash}"
    },
    {
      "kind": "atomscan",
      "url": "https://atomscan.com/decentr",
      "txPage": "https://atomscan.com/decentr/transactions/${txHash}",
      "accountPage": "https://atomscan.com/decentr/accounts/${accountAddress}"
    },
    {
      "kind": "Nodine.ID",
      "url": "https://explorer.co.id/decentr",
      "txPage": "https://explorer.co.id/decentr/tx/${txHash}"
    },
    {
      "kind": "THE EXPLORER",
      "url": "https://explorer.sxlzptprjkt.xyz/decentr",
      "txPage": "https://explorer.sxlzptprjkt.xyz/decentr/tx/${txHash}"
    },
    {
      "kind": "hexskrt EXPLORER",
      "url": "https://explorer.hexskrt.net/decentr",
      "txPage": "https://explorer.hexskrt.net/decentr/tx/${txHash}"
    },
    {
      "kind": "NODEXPLORER",
      "url": "https://explorer.nodexcapital.com/decentr",
      "txPage": "https://explorer.nodexcapital.com/decentr/tx/${txHash}"
    },
    {
      "kind": "Explorer ComunityNode",
      "url": "https://explorer.comunitynode.my.id/decentr",
      "txPage": "https://explorer.comunitynode.my.id/decentr/tx/${txHash}"
    }
  ],
  "images": [
    {
      "png": "https://raw.githubusercontent.com/cosmos/chain-registry/master/decentr/images/dec.png",
      "svg": "https://raw.githubusercontent.com/cosmos/chain-registry/master/decentr/images/dec.svg"
    }
  ]
}