{
  "$schema": "../chain.schema.json",
  "chainName": "arkh",
  "networkType": "mainnet",
  "website": "https://arkhadian.com/",
  "prettyName": "Arkhadian",
  "chainId": "arkh",
  "bech32Prefix": "arkh",
  "keyAlgos": [
    "secp256k1"
  ],
  "slip44": 118,
  "fees": {
    "feeTokens": [
      {
        "denom": "arkh",
        "fixedMinGasPrice": 0.01,
        "lowGasPrice": 0.01,
        "averageGasPrice": 0.025,
        "highGasPrice": 0.03
      }
    ]
  },
  "staking": {
    "stakingTokens": [
      {
        "denom": "arkh"
      }
    ]
  },
  "codebase": {

  },
  "apis": {
    "rpc": [
      {
        "address": "https://asc-dataseed.arkhadian.com/"
      },
      {
        "address": "https://arkh_mainnet_rpc.chain.whenmoonwhenlambo.money"
      }
    ],
    "rest": [
      {
        "address": "https://asc-blockchain-api.arkhadian.com/"
      },
      {
        "address": "https://arkh_mainnet_api.chain.whenmoonwhenlambo.money"
      }
    ],
    "grpc": [
      {
        "address": "grpc.arkh.nodestake.top:443"
      },
      {
        "address": "https://grpc.arkh.nodexcapital.com:443"
      }
    ]
  },
  "explorers": [
    {
      "kind": "NodeStake Explorer",
      "url": "https://explorer.nodestake.top/arkh",
      "txPage": "https://explorer.nodestake.top/arkh/tx/${txHash}"
    },
    {
      "kind": "Kynraze Explorer",
      "url": "https://explorer.kynraze.com/arkhadian",
      "txPage": "https://explorer.kynraze.com/arkhadian/tx/${txHash}"
    },
    {
      "kind": "NODEXPLORER",
      "url": "https://explorer.nodexcapital.com/arkhadian",
      "txPage": "https://explorer.nodexcapital.com/arkhadian/tx/${txHash}"
    },
    {
      "kind": "ðŸš€ WHEN MOON ðŸŒ• WHEN LAMBO ðŸ”¥",
      "url": "https://explorer.whenmoonwhenlambo.money/arkhadian",
      "txPage": "https://explorer.whenmoonwhenlambo.money/arkhadian/tx/${txHash}",
      "accountPage": "https://explorer.whenmoonwhenlambo.money/arkhadian/account/${accountAddress}"
    }
  ],
  "images": [
    {
      "png": "https://raw.githubusercontent.com/cosmos/chain-registry/master/arkh/images/arkh.png",
      "svg": "https://raw.githubusercontent.com/cosmos/chain-registry/master/arkh/images/arkh.svg"
    }
  ]
}